{
  "manifest_schema_id": "rcc002.review-manifest",
  "manifest_schema_version": "1.0.0",
  "manifest_schema_ref": "rcc002.review-manifest/1.0.0",
  "manifest_type": "review",
  "manifest_id": "manifest:sha256:0000000000000000000000000000000000000000000000000000000000000000",
  "created_at_utc": "2026-07-30T12:00:00Z",
  "producer": {
    "component": "rcc002-fixture-builder",
    "version": "1.0.0"
  },
  "project": "RCC-002",
  "status": "final",
  "subject_dataset_manifest_id": "manifest:sha256:0000000000000000000000000000000000000000000000000000000000000000",
  "subject_dataset_manifest_byte_sha256": "0000000000000000000000000000000000000000000000000000000000000000",
  "review_id": "RCC-002-REVIEW-001",
  "review_type": "scr",
  "reviewer": "internal-reviewer",
  "reviewer_system": "human",
  "reviewed_artifacts": [
    {
      "relative_path": "manifests/dataset.json",
      "byte_sha256": "0000000000000000000000000000000000000000000000000000000000000000"
    }
  ],
  "started_at_utc": "2026-07-30T12:00:00Z",
  "completed_at_utc": "2026-07-30T13:00:00Z",
  "review_status": "passed",
  "findings": [],
  "resolution_references": []
}
